{
  "schemaVersion": 1,
  "id": "opencode-completed-sessions",
  "corpusId": "opencode-completed-sessions",
  "definitionDigestSha256": "b73d31b6ee0e1df8ac1218e267a70020e70dfceb2f2f8feb19e8b9fcfca996e7",
  "eventSchemaDigestSha256": "eb77e231c036820a83586dd18e270cca068fea4da134a24ab113f1eb0f3b473b",
  "corpusDigestSha256": "2a41c19fd8939c8cb5ed7d933c734e903a1b61ea28f5c1228f616fda6196bfb4"
}
