{
  "schemaVersion": 1,
  "id": "opencode-completed-sessions-v4",
  "corpusId": "opencode-completed-sessions-v4",
  "definitionDigestSha256": "996a5071b75fc9a4b063cfc8978957f4ee99f1613b56b322338628c3f78012d7",
  "eventSchemaDigestSha256": "f6e789de10d8b54fbe8b640ff885843cbc564ac1eb262611083a050de0435cac",
  "corpusDigestSha256": "e8bc11728c10bc8a7931919d8292de0195c67652e9229b077fc18db412128400"
}
