{
  "schemaVersion": 1,
  "id": "opencode-completed-sessions-v2",
  "corpusId": "opencode-completed-sessions-v2",
  "definitionDigestSha256": "dea5abc03755f8d0584aa86612f62236c8a38f74d1ff9b91f39ac7bf8637725e",
  "eventSchemaDigestSha256": "f6e789de10d8b54fbe8b640ff885843cbc564ac1eb262611083a050de0435cac",
  "corpusDigestSha256": "1a86494c429d80ab14c65878623a8f77491b8f618d8e1f6e8917a7461b4d633a"
}
