{
  "schemaVersion": 1,
  "id": "opencode-completed-sessions-v3",
  "corpusId": "opencode-completed-sessions-v3",
  "definitionDigestSha256": "07b2ff89f29ed78b6a585b9814375dcc4272d9734755a160eef1b00727027d33",
  "eventSchemaDigestSha256": "f6e789de10d8b54fbe8b640ff885843cbc564ac1eb262611083a050de0435cac",
  "corpusDigestSha256": "8807d1dd81afb33fc6b22b457c4353298d21697421b509f77cc28e7f353c9dfc"
}
